"user_name","text","rating.x","url_cleaned","rubbish.x","id.x","user_id","id.y","name","price","rating.y","review_count","city","state","zip_code","rubbish.y","latitude","longitude"
"Ellie S.","Perfect space to study and it's not loud which I appreciate. They have non diary drinks and outdoor seatings as well!",4,"https://www.yelp.com/biz/kave-brooklyn","adjust_creative=SQ3SyM_wbzFDMvSqxv9K6A&hrid=LTL95SsDExXtUSP8yfIdzA&utm_campaign=yelp_api_v3&utm_medium=api_v3_business_reviews&utm_source=SQ3SyM_wbzFDMvSqxv9K6A","kave-brooklyn","f6_S2BYuJXDbzqRYyMNYgg","2m-B_OlrpiTV8oeA7UNV_w","KAVE","$$",4,183,"Brooklyn","NY","11237","adjust_creative=SQ3SyM_wbzFDMvSqxv9K6A&utm_campaign=yelp_api_v3&utm_medium=api_v3_business_search&utm_source=SQ3SyM_wbzFDMvSqxv9K6A",40.7051,-73.9291
"Rodrigo T.","Really nice and quiet place to have coffee. It's a small shop so it's definitely super intimate. I had a house brew which was perfect.

The setting was very...",5,"https://www.yelp.com/biz/kahve-new-york-4","adjust_creative=SQ3SyM_wbzFDMvSqxv9K6A&hrid=RZbpTQprOmYlepkgWW-5Pw&utm_campaign=yelp_api_v3&utm_medium=api_v3_business_reviews&utm_source=SQ3SyM_wbzFDMvSqxv9K6A","kahve-new-york-4","Xnqbsqex72_KYsOk4AbqDg","7r0jxWDWcJd8B0KhMN2LbA","Kahve","$",4,79,"New York","NY","10019","adjust_creative=SQ3SyM_wbzFDMvSqxv9K6A&utm_campaign=yelp_api_v3&utm_medium=api_v3_business_search&utm_source=SQ3SyM_wbzFDMvSqxv9K6A",40.7644,-73.9888
"Jenny L.","Was in search of a sit down breakfast joint to hold me over for about an hour which is difficult nowadays with COVID. Found this place randomly and decided...",5,"https://www.yelp.com/biz/blank-slate-coffee-kitchen-new-york-3","adjust_creative=SQ3SyM_wbzFDMvSqxv9K6A&hrid=vbkRR3hTLiNzLpITH8OvTQ&utm_campaign=yelp_api_v3&utm_medium=api_v3_business_reviews&utm_source=SQ3SyM_wbzFDMvSqxv9K6A","blank-slate-coffee-kitchen-new-york-3","crLVKe890iiFdocQjii67Q","Ry04HQ6kNsF1RYTjINDaYw","Blank Slate Coffee + Kitchen","$$",4,637,"New York","NY","10016","adjust_creative=SQ3SyM_wbzFDMvSqxv9K6A&utm_campaign=yelp_api_v3&utm_medium=api_v3_business_search&utm_source=SQ3SyM_wbzFDMvSqxv9K6A",40.7453,-73.9845
"Roop K.","This is a cute place that you almost wouldn't notice walking by but they have a few chairs and tables set up outside you can sit and sip your coffee. 

It's...",5,"https://www.yelp.com/biz/the-coffee-inn-new-york","adjust_creative=SQ3SyM_wbzFDMvSqxv9K6A&hrid=ZSTBT56IT7W_YRw5kGA5oQ&utm_campaign=yelp_api_v3&utm_medium=api_v3_business_reviews&utm_source=SQ3SyM_wbzFDMvSqxv9K6A","the-coffee-inn-new-york","vn_MbtVBAPZsz9N4zgKA-A","OMHH97xIajGoCK_G-X3x_Q","The Coffee Inn","$",4,163,"New York","NY","10021","adjust_creative=SQ3SyM_wbzFDMvSqxv9K6A&utm_campaign=yelp_api_v3&utm_medium=api_v3_business_search&utm_source=SQ3SyM_wbzFDMvSqxv9K6A",40.7668,-73.9565
"Rosalia X.","I love their overnight oats, however when I got it for delivery it was watery I was so upset. I had to put it in the fridge so I can eat it the next day. My...",4,"https://www.yelp.com/biz/cocoa-grinder-brooklyn-2","adjust_creative=SQ3SyM_wbzFDMvSqxv9K6A&hrid=N7caOXxhbPJOJsB2intcBw&utm_campaign=yelp_api_v3&utm_medium=api_v3_business_reviews&utm_source=SQ3SyM_wbzFDMvSqxv9K6A","cocoa-grinder-brooklyn-2","BvRUwN5QUWOdWaYLMEKY2g","1Zxt8jFj1ZnGTHlOgNbZIQ","Cocoa Grinder","$$",4,317,"Brooklyn","NY","11209","adjust_creative=SQ3SyM_wbzFDMvSqxv9K6A&utm_campaign=yelp_api_v3&utm_medium=api_v3_business_search&utm_source=SQ3SyM_wbzFDMvSqxv9K6A",40.6241,-74.0307
"Amara R.","These biscuits. I don't know what they put in them, but they're amazing. Usually the chicken is the clear highlight whenever there's a chicken + biscuit...",5,"https://www.yelp.com/biz/brown-butter-brooklyn","adjust_creative=SQ3SyM_wbzFDMvSqxv9K6A&hrid=EwptDEPCdUvnOYTRYbWcIQ&utm_campaign=yelp_api_v3&utm_medium=api_v3_business_reviews&utm_source=SQ3SyM_wbzFDMvSqxv9K6A","brown-butter-brooklyn","RVl4wNUwiOHN79rzvld5XA","L-wRe60w0SkwB4xcQuyptA","Brown Butter","$$",4,155,"Brooklyn","NY","11216","adjust_creative=SQ3SyM_wbzFDMvSqxv9K6A&utm_campaign=yelp_api_v3&utm_medium=api_v3_business_search&utm_source=SQ3SyM_wbzFDMvSqxv9K6A",40.6834,-73.9437
"Elinore W.","Appreciations to yelp for recommending 2Beans. I'm so thrilled to be here and the atmosphere is so pretty. Every single thing that we have purchased was...",5,"https://www.yelp.com/biz/2beans-new-york","adjust_creative=SQ3SyM_wbzFDMvSqxv9K6A&hrid=Vep4uLkpTDl_Mu7by510vw&utm_campaign=yelp_api_v3&utm_medium=api_v3_business_reviews&utm_source=SQ3SyM_wbzFDMvSqxv9K6A","2beans-new-york","fx53r9WgveiAJIdk7Mixag","2uVut84nu_1J1iXRoXRMiQ","2Beans","$$",4,174,"New York","NY","10017","adjust_creative=SQ3SyM_wbzFDMvSqxv9K6A&utm_campaign=yelp_api_v3&utm_medium=api_v3_business_search&utm_source=SQ3SyM_wbzFDMvSqxv9K6A",40.7511,-73.9789
"nyc e.","I used to frequent Ceci-Cela when they were just the little original shop in Soho on spring street. The owner always used to be there, kind of cranky and...",4,"https://www.yelp.com/biz/ceci-cela-new-york-2","adjust_creative=SQ3SyM_wbzFDMvSqxv9K6A&hrid=U5Y07KqQ8L2h6na5fTDgoA&utm_campaign=yelp_api_v3&utm_medium=api_v3_business_reviews&utm_source=SQ3SyM_wbzFDMvSqxv9K6A","ceci-cela-new-york-2","_Xj3aE2sAHFbSzQTUIAfeA","N7ux8gAg5udFTgZ2Y5P-6A","Ceci-Cela","$$",4,566,"New York","NY","10012","adjust_creative=SQ3SyM_wbzFDMvSqxv9K6A&utm_campaign=yelp_api_v3&utm_medium=api_v3_business_search&utm_source=SQ3SyM_wbzFDMvSqxv9K6A",40.7203,-73.9931
"Enara R.","Oh my god. Updating this review because I needed to put out there that the pistachio roll is absolutely FANTASTIC. 

I came in today to grab some iced...",5,"https://www.yelp.com/biz/tar-pit-brooklyn","adjust_creative=SQ3SyM_wbzFDMvSqxv9K6A&hrid=117IRqL6TEtKaiayOCcATw&utm_campaign=yelp_api_v3&utm_medium=api_v3_business_reviews&utm_source=SQ3SyM_wbzFDMvSqxv9K6A","tar-pit-brooklyn","L_r7bZApEPcmY6Koivqubw","L9zblU1B2zkGBjP1uqLHUg","Tar Pit","$",4,80,"Brooklyn","NY","11211","adjust_creative=SQ3SyM_wbzFDMvSqxv9K6A&utm_campaign=yelp_api_v3&utm_medium=api_v3_business_search&utm_source=SQ3SyM_wbzFDMvSqxv9K6A",40.7176,-73.9412
"Gab G.","COVID Report: Leo currently has pantry items for sale, as well as heated outdoor tables. You can sit outside and use their mobile ordering system, or order...",5,"https://www.yelp.com/biz/leo-brooklyn","adjust_creative=SQ3SyM_wbzFDMvSqxv9K6A&hrid=sddd7rzj4cMRm7o2D3nN2g&utm_campaign=yelp_api_v3&utm_medium=api_v3_business_reviews&utm_source=SQ3SyM_wbzFDMvSqxv9K6A","leo-brooklyn","HVQKFDi-vZbawtmLMq3ZOw","nLMJL4p7k4jNO4qLMc1wNg","Leo","$$",4,21,"Brooklyn","NY","11211","adjust_creative=SQ3SyM_wbzFDMvSqxv9K6A&utm_campaign=yelp_api_v3&utm_medium=api_v3_business_search&utm_source=SQ3SyM_wbzFDMvSqxv9K6A",40.7126,-73.9568
"Natasha D.","We went there for brunch on a weekday. It was perfect. They had the heaters on. The food and the service was great. The tables are well placed for social...",5,"https://www.yelp.com/biz/citizens-of-chelsea-new-york","adjust_creative=SQ3SyM_wbzFDMvSqxv9K6A&hrid=DRcSglxhPqtgUa8sDo5WPg&utm_campaign=yelp_api_v3&utm_medium=api_v3_business_reviews&utm_source=SQ3SyM_wbzFDMvSqxv9K6A","citizens-of-chelsea-new-york","8KGrrJjrU5HEgOksafE7lw","FaR-Kv-0ZzgcqFW1sCnacw","Citizens of Chelsea","$$",4,746,"New York","NY","10001","adjust_creative=SQ3SyM_wbzFDMvSqxv9K6A&utm_campaign=yelp_api_v3&utm_medium=api_v3_business_search&utm_source=SQ3SyM_wbzFDMvSqxv9K6A",40.7481,-74.0006
"Ngoc P.","To my Argentinian barista boyfriend. I like the way you flick your wrist when you froth milk for my cappuccino. The way you describe what's in that decadent...",5,"https://www.yelp.com/biz/latte-art-new-york","adjust_creative=SQ3SyM_wbzFDMvSqxv9K6A&hrid=yBroa35MYm2BLYRdd1eThA&utm_campaign=yelp_api_v3&utm_medium=api_v3_business_reviews&utm_source=SQ3SyM_wbzFDMvSqxv9K6A","latte-art-new-york","zJlmL8AO66_M1b1cQD0d9Q","xKzot1NY6ISEwmN2y5HRdA","Latte Art","$",4,103,"New York","NY","10004","adjust_creative=SQ3SyM_wbzFDMvSqxv9K6A&utm_campaign=yelp_api_v3&utm_medium=api_v3_business_search&utm_source=SQ3SyM_wbzFDMvSqxv9K6A",40.7042,-74.0121
"Andrew K.","These flaky, glazed and cream filled pastries have flown off the shelves since conception and in recent years were near impossible to get your hands on...",5,"https://www.yelp.com/biz/dominique-ansel-bakery-new-york","adjust_creative=SQ3SyM_wbzFDMvSqxv9K6A&hrid=3kJlDtOvtFRWvjFTDuEJIA&utm_campaign=yelp_api_v3&utm_medium=api_v3_business_reviews&utm_source=SQ3SyM_wbzFDMvSqxv9K6A","dominique-ansel-bakery-new-york","B84U6lanAqmupVluYpSpSQ","ga6sRtE0l85iftw_5-W84Q","Dominique Ansel Bakery","$$",4,4606,"New York","NY","10012","adjust_creative=SQ3SyM_wbzFDMvSqxv9K6A&utm_campaign=yelp_api_v3&utm_medium=api_v3_business_search&utm_source=SQ3SyM_wbzFDMvSqxv9K6A",40.7252,-74.0029
"Chelsea W.","So happy I found this place during Covid! I love all the different options they have, from bubble tea to dumplings to avocado toast. I've gotten the egg,...",5,"https://www.yelp.com/biz/ut47-new-york-3","adjust_creative=SQ3SyM_wbzFDMvSqxv9K6A&hrid=PXF6VKMqiwKYwxILNdwxJw&utm_campaign=yelp_api_v3&utm_medium=api_v3_business_reviews&utm_source=SQ3SyM_wbzFDMvSqxv9K6A","ut47-new-york-3","YHe5qdBZqhmuEQwT7Ykb8A","JylIStPfFLOctHdlglvALA","UT47","$",4,241,"New York","NY","10036","adjust_creative=SQ3SyM_wbzFDMvSqxv9K6A&utm_campaign=yelp_api_v3&utm_medium=api_v3_business_search&utm_source=SQ3SyM_wbzFDMvSqxv9K6A",40.7613,-73.99
"Melinda D.","I decided to try coffee delivery when my usual roaster went out of business. I'm extremely picky about my coffee, so I was pretty sceptical at first, but...",5,"https://www.yelp.com/biz/craft-coffee-williamsburg-2","adjust_creative=SQ3SyM_wbzFDMvSqxv9K6A&hrid=M7ZQyZ_qvREV7avbBj8kUw&utm_campaign=yelp_api_v3&utm_medium=api_v3_business_reviews&utm_source=SQ3SyM_wbzFDMvSqxv9K6A","craft-coffee-williamsburg-2","p0NOwaem2l2vPL4uGxIJBA","1pgT01ST-JpeS6b5ixspYA","Craft Coffee","$$",4,34,"Williamsburg","NY","11249","adjust_creative=SQ3SyM_wbzFDMvSqxv9K6A&utm_campaign=yelp_api_v3&utm_medium=api_v3_business_search&utm_source=SQ3SyM_wbzFDMvSqxv9K6A",40.716,-73.9623
"Stephanie W.","The food is always on point! Made Fresh Daily is really Made with Fresh ingredients. A must try would be their Turkey Meatloaf! Their chive butter is a...",5,"https://www.yelp.com/biz/made-fresh-daily-new-york","adjust_creative=SQ3SyM_wbzFDMvSqxv9K6A&hrid=m6KtwvtrUocyUO9KYMVIaQ&utm_campaign=yelp_api_v3&utm_medium=api_v3_business_reviews&utm_source=SQ3SyM_wbzFDMvSqxv9K6A","made-fresh-daily-new-york","z8PX0gaqrSMqa4y9u_CMOQ","Dq_KwjD7WpGmgrXiu0qEOg","Made Fresh Daily","$$",4,193,"New York","NY","10038","adjust_creative=SQ3SyM_wbzFDMvSqxv9K6A&utm_campaign=yelp_api_v3&utm_medium=api_v3_business_search&utm_source=SQ3SyM_wbzFDMvSqxv9K6A",40.7077,-74.0022
"Vickie W.","Time Cafe is a chic little spot on Canal that wishes it were on Division St (aka the hub of white Chinatown). The food they serve here is very simple, to...",4,"https://www.yelp.com/biz/time-caf%C3%A9-new-york-9","adjust_creative=SQ3SyM_wbzFDMvSqxv9K6A&hrid=xG-VkZ6HJLIY4B3gGL1ohA&utm_campaign=yelp_api_v3&utm_medium=api_v3_business_reviews&utm_source=SQ3SyM_wbzFDMvSqxv9K6A","time-caf%C3%A9-new-york-9","v1wOhhRrjsQw6ppkkvk_Bg","Gwu2o8fHSjNBZzvBP6Ci7A","Time Café","NULL",4,11,"New York","NY","10002","adjust_creative=SQ3SyM_wbzFDMvSqxv9K6A&utm_campaign=yelp_api_v3&utm_medium=api_v3_business_search&utm_source=SQ3SyM_wbzFDMvSqxv9K6A",40.7157,-73.994
"Lilian N.","One of The coolest things about New York is the unlimited choices of restaurants and cafes. You can't walk 5 blocks without passing by something to eat! And...",5,"https://www.yelp.com/biz/summers-soho-new-york","adjust_creative=SQ3SyM_wbzFDMvSqxv9K6A&hrid=N0PucSw6Tsr7ZEWIxKU3KA&utm_campaign=yelp_api_v3&utm_medium=api_v3_business_reviews&utm_source=SQ3SyM_wbzFDMvSqxv9K6A","summers-soho-new-york","8DWFt0qfQZhrtBmwDZO04w","y6p3LN0RdBYuDy7EZ_2S_A","Summers SoHo","$$",4,65,"New York","NY","10012","adjust_creative=SQ3SyM_wbzFDMvSqxv9K6A&utm_campaign=yelp_api_v3&utm_medium=api_v3_business_search&utm_source=SQ3SyM_wbzFDMvSqxv9K6A",40.7277,-74.0004
"Luke B.","I love this place. Let me explain. 

----Responsible----

- A+ Covid response. (See final section)

-Super progressive

-Eco conscious. They're actively...",5,"https://www.yelp.com/biz/little-skips-east-brooklyn-2","adjust_creative=SQ3SyM_wbzFDMvSqxv9K6A&hrid=P2WsKZF-uoFkvJhKP53ZEg&utm_campaign=yelp_api_v3&utm_medium=api_v3_business_reviews&utm_source=SQ3SyM_wbzFDMvSqxv9K6A","little-skips-east-brooklyn-2","p-82ydisThEu5qNgzT-3mA","yMxGI1kcqv6a-aGH-VXg8A","Little Skips East","$",4,64,"Brooklyn","NY","11207","adjust_creative=SQ3SyM_wbzFDMvSqxv9K6A&utm_campaign=yelp_api_v3&utm_medium=api_v3_business_search&utm_source=SQ3SyM_wbzFDMvSqxv9K6A",40.6849,-73.9138
"Lawrence C.","This was a doughnut place that we checked out in New York when we just wanted a quick breakfast, and we really enjoyed it! We came here pre-Covid and the...",5,"https://www.yelp.com/biz/dough-new-york-2","adjust_creative=SQ3SyM_wbzFDMvSqxv9K6A&hrid=TE5FeVcrQ73pM2to2PyrZA&utm_campaign=yelp_api_v3&utm_medium=api_v3_business_reviews&utm_source=SQ3SyM_wbzFDMvSqxv9K6A","dough-new-york-2","_7j3YoRDJNA0_28b8dF6SA","ZMQzXIiqdBIuicFySTWGKg","Dough","$",4,1532,"New York","NY","10011","adjust_creative=SQ3SyM_wbzFDMvSqxv9K6A&utm_campaign=yelp_api_v3&utm_medium=api_v3_business_search&utm_source=SQ3SyM_wbzFDMvSqxv9K6A",40.7393,-73.9924
"Sarah R.","Southside not only has amazing (& consistent) coffee, but they've single-handedly gotten me to eat meat anytime I go there.  My husband gets the 295...",5,"https://www.yelp.com/biz/southside-coffee-brooklyn","adjust_creative=SQ3SyM_wbzFDMvSqxv9K6A&hrid=F7tTQzMKcwzUIi_ddFGp-Q&utm_campaign=yelp_api_v3&utm_medium=api_v3_business_reviews&utm_source=SQ3SyM_wbzFDMvSqxv9K6A","southside-coffee-brooklyn","gzwcmN4nOgFw09laP3wMJA","D-th9tb5poA6fZJinD2qCg","Southside Coffee","$",4,200,"Brooklyn","NY","11215","adjust_creative=SQ3SyM_wbzFDMvSqxv9K6A&utm_campaign=yelp_api_v3&utm_medium=api_v3_business_search&utm_source=SQ3SyM_wbzFDMvSqxv9K6A",40.6612,-73.9903
"Sarah P.","First, the food is amazing. However, the delivery is not great. When  we order from seamless or grubhub  we get our order at at higher cost no problem. When...",5,"https://www.yelp.com/biz/tutt-cafe-brooklyn","adjust_creative=SQ3SyM_wbzFDMvSqxv9K6A&hrid=-GoSQ03T11MuqJl9-o8F3g&utm_campaign=yelp_api_v3&utm_medium=api_v3_business_reviews&utm_source=SQ3SyM_wbzFDMvSqxv9K6A","tutt-cafe-brooklyn","q4zT2i9CgPo18XO4SrL29w","HcWm-9ZZu2_brnuRxN5Gpg","Tutt Cafe","$",4,231,"Brooklyn","NY","11201","adjust_creative=SQ3SyM_wbzFDMvSqxv9K6A&utm_campaign=yelp_api_v3&utm_medium=api_v3_business_search&utm_source=SQ3SyM_wbzFDMvSqxv9K6A",40.7002,-73.9932
"Sandra M.","I knew the spot had a great location. What I didn't expect was how helpful and helpful the crew would be.. Relaxing, classy, quiet, warm, inviting and high...",5,"https://www.yelp.com/biz/coffee-factory-flushing","adjust_creative=SQ3SyM_wbzFDMvSqxv9K6A&hrid=EpXniZ-6UtxIcjYMTrP0uA&utm_campaign=yelp_api_v3&utm_medium=api_v3_business_reviews&utm_source=SQ3SyM_wbzFDMvSqxv9K6A","coffee-factory-flushing","y6XhtFGNhBS5vdH1Os7I6Q","Keo41lSMGSfoe9GMjkJ5Zw","Coffee Factory","$$",4,250,"Flushing","NY","11354","adjust_creative=SQ3SyM_wbzFDMvSqxv9K6A&utm_campaign=yelp_api_v3&utm_medium=api_v3_business_search&utm_source=SQ3SyM_wbzFDMvSqxv9K6A",40.7632,-73.8143
"Sona D.","I came here on a Sunday morning around 11am and there was a line of about 10 people ahead of us and it moved pretty fast (~30 minutes). They were only...",5,"https://www.yelp.com/biz/supermoon-bakehouse-new-york","adjust_creative=SQ3SyM_wbzFDMvSqxv9K6A&hrid=DuSs8kMAeQAZ0UXicQjMzQ&utm_campaign=yelp_api_v3&utm_medium=api_v3_business_reviews&utm_source=SQ3SyM_wbzFDMvSqxv9K6A","supermoon-bakehouse-new-york","RmWLnIpEv1X3kGXoL8gxrg","b5x-Fw7I7Y88TdFIzvbsnw","Supermoon Bakehouse","$$",4,745,"New York","NY","10002","adjust_creative=SQ3SyM_wbzFDMvSqxv9K6A&utm_campaign=yelp_api_v3&utm_medium=api_v3_business_search&utm_source=SQ3SyM_wbzFDMvSqxv9K6A",40.7199,-73.9872
"Peggy W.","The daytime coffee shop front of Patent Pending. It's a hidden gem that's easy to miss. The coffee here is excellent, and the service is always friendly and...",5,"https://www.yelp.com/biz/patent-coffee-new-york","adjust_creative=SQ3SyM_wbzFDMvSqxv9K6A&hrid=ULIkgz-N_I43JnnkAs8dHA&utm_campaign=yelp_api_v3&utm_medium=api_v3_business_reviews&utm_source=SQ3SyM_wbzFDMvSqxv9K6A","patent-coffee-new-york","VpfdpNvz4GxaJ3-fHTMaAw","W2J0N6PXDWYSMPmp-1xIww","Patent Coffee","$",4,58,"New York","NY","10001","adjust_creative=SQ3SyM_wbzFDMvSqxv9K6A&utm_campaign=yelp_api_v3&utm_medium=api_v3_business_search&utm_source=SQ3SyM_wbzFDMvSqxv9K6A",40.7453,-73.9903
"Michael M.","Good coffee and I love their pastries. My wife and I just moved into the neighborhood and was glad to discover this great find. We will be sure to come back...",5,"https://www.yelp.com/biz/cafe-buunni-new-york-2","adjust_creative=SQ3SyM_wbzFDMvSqxv9K6A&hrid=gOCZsIk2cL5nI4NWeR-GdQ&utm_campaign=yelp_api_v3&utm_medium=api_v3_business_reviews&utm_source=SQ3SyM_wbzFDMvSqxv9K6A","cafe-buunni-new-york-2","EvssILheDQdrkUO1SDbEJw","ciAah2_V_2km3K4RrXresA","Cafe Buunni","$",4,125,"New York","NY","10033","adjust_creative=SQ3SyM_wbzFDMvSqxv9K6A&utm_campaign=yelp_api_v3&utm_medium=api_v3_business_search&utm_source=SQ3SyM_wbzFDMvSqxv9K6A",40.8551,-73.9377
"Radia A.","Hands down best cafe in the area. It's a spacious cafe compared to many others that tend to be much smaller. It has a variety of seating for people coming...",5,"https://www.yelp.com/biz/kuppi-coffee-company-edgewater-2","adjust_creative=SQ3SyM_wbzFDMvSqxv9K6A&hrid=nZZD7xLwW-BoUO8Lc1aUEA&utm_campaign=yelp_api_v3&utm_medium=api_v3_business_reviews&utm_source=SQ3SyM_wbzFDMvSqxv9K6A","kuppi-coffee-company-edgewater-2","Ljhnb1xsenkE6lTuP0NKlw","YGtYFrBj7g0SGDLPGSiEnQ","Kuppi Coffee Company","$",4,454,"Edgewater","NJ","07020","adjust_creative=SQ3SyM_wbzFDMvSqxv9K6A&utm_campaign=yelp_api_v3&utm_medium=api_v3_business_search&utm_source=SQ3SyM_wbzFDMvSqxv9K6A",40.8189,-73.9768
"Jaybo S.","Thank you for staying open as much as possible during the pandemic. This neighborhood gem has been a warm, comforting presence the 13 years I've lived here.",5,"https://www.yelp.com/biz/aubergine-cafe-woodside-3","adjust_creative=SQ3SyM_wbzFDMvSqxv9K6A&hrid=1kPOuAJU5LTl1peHpekkng&utm_campaign=yelp_api_v3&utm_medium=api_v3_business_reviews&utm_source=SQ3SyM_wbzFDMvSqxv9K6A","aubergine-cafe-woodside-3","QNapdUpck94TIfJhZDAbsA","ngrgNE6xT54amiZvxGttWw","Aubergine Cafe","$$",4,329,"Woodside","NY","11377","adjust_creative=SQ3SyM_wbzFDMvSqxv9K6A&utm_campaign=yelp_api_v3&utm_medium=api_v3_business_search&utm_source=SQ3SyM_wbzFDMvSqxv9K6A",40.7461,-73.9149
"Angela D.","Went here for a pick-up drink during the COVID pandemic. I was kinda bummed out that soft serve wasn't available, but I got an iced oat turmeric ginger...",4,"https://www.yelp.com/biz/cha-cha-matcha-new-york-8","adjust_creative=SQ3SyM_wbzFDMvSqxv9K6A&hrid=2u0aTPZihKmt8c4sgz4tNQ&utm_campaign=yelp_api_v3&utm_medium=api_v3_business_reviews&utm_source=SQ3SyM_wbzFDMvSqxv9K6A","cha-cha-matcha-new-york-8","o6YfPdjgWngCKERE4oUEIQ","8zIXMsbcDS7kqH8N-09zLg","Cha Cha Matcha","$$",4,918,"New York","NY","10013","adjust_creative=SQ3SyM_wbzFDMvSqxv9K6A&utm_campaign=yelp_api_v3&utm_medium=api_v3_business_search&utm_source=SQ3SyM_wbzFDMvSqxv9K6A",40.7201,-73.9963
"Chary S.","This was one of the first coffee shops I explored when I newly moved into the neighborhood.

I'm glad I did: strong coffee. Affordable. Friendly staff!...",5,"https://www.yelp.com/biz/furmans-coffee-brooklyn","adjust_creative=SQ3SyM_wbzFDMvSqxv9K6A&hrid=OpjrorLsjCTMJhBmuIVlAg&utm_campaign=yelp_api_v3&utm_medium=api_v3_business_reviews&utm_source=SQ3SyM_wbzFDMvSqxv9K6A","furmans-coffee-brooklyn","x_aBr6utOrK1wBQvPfdhaw","ENfQQkAsJ6xwb2WmoktatA","Furman's Coffee","$",4,58,"Brooklyn","NY","11216","adjust_creative=SQ3SyM_wbzFDMvSqxv9K6A&utm_campaign=yelp_api_v3&utm_medium=api_v3_business_search&utm_source=SQ3SyM_wbzFDMvSqxv9K6A",40.6788,-73.9496
"Jenna I.","You know that feeling when you get out of the graveyard and you're just vying for some bread? Well dream no longer because Baked By Brooklyn is perfectly...",4,"https://www.yelp.com/biz/baked-in-brooklyn-bakery-store-brooklyn","adjust_creative=SQ3SyM_wbzFDMvSqxv9K6A&hrid=nfqUHs-NkUc0IE7kJXMJXQ&utm_campaign=yelp_api_v3&utm_medium=api_v3_business_reviews&utm_source=SQ3SyM_wbzFDMvSqxv9K6A","baked-in-brooklyn-bakery-store-brooklyn","SQIfkwKkwH_iD-urr0Fiew","w8eAlTI-8pbVecPsWMrEMw","Baked In Brooklyn Bakery Store","$",4,245,"Brooklyn","NY","11232","adjust_creative=SQ3SyM_wbzFDMvSqxv9K6A&utm_campaign=yelp_api_v3&utm_medium=api_v3_business_search&utm_source=SQ3SyM_wbzFDMvSqxv9K6A",40.6589,-73.9964
"Hana S.","Ordered from here via Spread to minimize delivery app fees for small businesses, I understand times are tough right now and want to do what I can to support...",5,"https://www.yelp.com/biz/ange-noir-cafe-brooklyn","adjust_creative=SQ3SyM_wbzFDMvSqxv9K6A&hrid=1GW2C9MZZX8dckaInGQ-WQ&utm_campaign=yelp_api_v3&utm_medium=api_v3_business_reviews&utm_source=SQ3SyM_wbzFDMvSqxv9K6A","ange-noir-cafe-brooklyn","kY2IvXTFgam-vNCRTOj-yg","-zzMDQkhZzrnBUdrfpG3Ng","Ange Noir Cafe","$",4,107,"Brooklyn","NY","11206","adjust_creative=SQ3SyM_wbzFDMvSqxv9K6A&utm_campaign=yelp_api_v3&utm_medium=api_v3_business_search&utm_source=SQ3SyM_wbzFDMvSqxv9K6A",40.7043,-73.9342
"Marcy C.","The workers here are really nice and friendly.I actually went here back before the pandemic with with 2 friends of mine. I was reminiscing on my trip and...",5,"https://www.yelp.com/biz/tisserie-new-york-2","adjust_creative=SQ3SyM_wbzFDMvSqxv9K6A&hrid=64LNh-M6w8WBDiS7mc7m5A&utm_campaign=yelp_api_v3&utm_medium=api_v3_business_reviews&utm_source=SQ3SyM_wbzFDMvSqxv9K6A","tisserie-new-york-2","Hxbd6H50cK0gVq1VqHXPIg","PK-ohmmqEQXipgm_U8JjrA","Tisserie","$",4,363,"New York","NY","10019","adjust_creative=SQ3SyM_wbzFDMvSqxv9K6A&utm_campaign=yelp_api_v3&utm_medium=api_v3_business_search&utm_source=SQ3SyM_wbzFDMvSqxv9K6A",40.7644,-73.9811
"Chris Y.","Brazilian cafe!

Food 5/5
I came for coffee but I think it specializes in Brazilian cheese bread. Looks amazing and lots of people came just for it. Will...",5,"https://www.yelp.com/biz/tap-nyc-new-york","adjust_creative=SQ3SyM_wbzFDMvSqxv9K6A&hrid=r6ezCw2ErQfMIpI07kZryA&utm_campaign=yelp_api_v3&utm_medium=api_v3_business_reviews&utm_source=SQ3SyM_wbzFDMvSqxv9K6A","tap-nyc-new-york","w6BkjniQXwqs0jyRq5F4HQ","H2_mpDKae_hILgi0AG_9_A","Tap NYC","$$",4,193,"New York","NY","10023","adjust_creative=SQ3SyM_wbzFDMvSqxv9K6A&utm_campaign=yelp_api_v3&utm_medium=api_v3_business_search&utm_source=SQ3SyM_wbzFDMvSqxv9K6A",40.7777,-73.9785
"Eric C.","I went here because after a stroll along Manhattan Beach on an unseasonable warm day I could use a cup of coffee.

We looked up best cups of coffee in the...",5,"https://www.yelp.com/biz/orso-coffee-brooklyn","adjust_creative=SQ3SyM_wbzFDMvSqxv9K6A&hrid=8GCtmcQYlsniaCbxPYbXDA&utm_campaign=yelp_api_v3&utm_medium=api_v3_business_reviews&utm_source=SQ3SyM_wbzFDMvSqxv9K6A","orso-coffee-brooklyn","GL6qwC_XknPDwiylqhO6Jg","R1VKt0kDto8bbjn5myEU8w","Orso Coffee","$",4,128,"Brooklyn","NY","11235","adjust_creative=SQ3SyM_wbzFDMvSqxv9K6A&utm_campaign=yelp_api_v3&utm_medium=api_v3_business_search&utm_source=SQ3SyM_wbzFDMvSqxv9K6A",40.585,-73.9511
"Camille V.","I really like Café Regular du Nord. Clean and a great crowd! They got a wonderful menu also. The staff was fabulous, literally everyone. My family will...",4,"https://www.yelp.com/biz/caf%C3%A9-regular-du-nord-brooklyn-3","adjust_creative=SQ3SyM_wbzFDMvSqxv9K6A&hrid=Sx-DdzR_dU7SGqyOxuUYTg&utm_campaign=yelp_api_v3&utm_medium=api_v3_business_reviews&utm_source=SQ3SyM_wbzFDMvSqxv9K6A","caf%C3%A9-regular-du-nord-brooklyn-3","0FCLCWIfFLfhHoHbqxm88A","MHqjy9jTeMQqqNRPzyI2Aw","Café Regular du Nord","$$",4,154,"Brooklyn","NY","11217","adjust_creative=SQ3SyM_wbzFDMvSqxv9K6A&utm_campaign=yelp_api_v3&utm_medium=api_v3_business_search&utm_source=SQ3SyM_wbzFDMvSqxv9K6A",40.6751,-73.9755
"Maryjane L.","Cup & Cup was great. They have great selection of items with fair prices for what u get. OMG, their Cod Roe Cream Udon was absolutely delightful, such a...",5,"https://www.yelp.com/biz/cup-and-cup-new-york","adjust_creative=SQ3SyM_wbzFDMvSqxv9K6A&hrid=pGv75z2V165N4KFxYqYhoA&utm_campaign=yelp_api_v3&utm_medium=api_v3_business_reviews&utm_source=SQ3SyM_wbzFDMvSqxv9K6A","cup-and-cup-new-york","7ZQdf0DLLegRxDchRZ4GuA","h881bFbXCIZdI99-mPOoyA","Cup & Cup","$",4,337,"New York","NY","10016","adjust_creative=SQ3SyM_wbzFDMvSqxv9K6A&utm_campaign=yelp_api_v3&utm_medium=api_v3_business_search&utm_source=SQ3SyM_wbzFDMvSqxv9K6A",40.7462,-73.9848
"AJ J.","Great French bakery. The baked goods are usually top notch at a decent price. The owner is actually French. The baguette is really good as well as all of...",5,"https://www.yelp.com/biz/benys-delice-brooklyn","adjust_creative=SQ3SyM_wbzFDMvSqxv9K6A&hrid=RUcw5UHuwPa3dAXQstwNxw&utm_campaign=yelp_api_v3&utm_medium=api_v3_business_reviews&utm_source=SQ3SyM_wbzFDMvSqxv9K6A","benys-delice-brooklyn","6jv6AX0KtP0F2kFYBSV3vg","D6FIbzVVd0JjzGb4jxxaEQ","Beny's Delice","$",4,121,"Brooklyn","NY","11238","adjust_creative=SQ3SyM_wbzFDMvSqxv9K6A&utm_campaign=yelp_api_v3&utm_medium=api_v3_business_search&utm_source=SQ3SyM_wbzFDMvSqxv9K6A",40.6837,-73.9672
