"user_name","text","rating.x","url_cleaned","rubbish.x","id.x","user_id","id.y","name","price","rating.y","review_count","city","state","zip_code","rubbish.y","latitude","longitude"
"Lauren D.","Cute little coffee place that really makes you feel like you're on an episode of Friends. They have nice seasonal drinks and it is a great stop on the way...",5,"https://www.yelp.com/biz/perk-kafe-new-york","adjust_creative=SQ3SyM_wbzFDMvSqxv9K6A&hrid=6B7flL2oBOaAQK3nakP2hA&utm_campaign=yelp_api_v3&utm_medium=api_v3_business_reviews&utm_source=SQ3SyM_wbzFDMvSqxv9K6A","perk-kafe-new-york","AJCb2xJ7pNu1LNQ9-9vzzg","xHBpwGzxxbC3vTahHWdABg","Perk Kafe","$",4.5,393,"New York","NY","10016","adjust_creative=SQ3SyM_wbzFDMvSqxv9K6A&utm_campaign=yelp_api_v3&utm_medium=api_v3_business_search&utm_source=SQ3SyM_wbzFDMvSqxv9K6A",40.7478,-73.977
"Jennifer Y.","This is a small takeout place that has the best rice sandwiches! Looking at the pictures on yelp, I didn't know if it was going to be a long wait. When I...",5,"https://www.yelp.com/biz/969-nyc-coffee-jackson-heights-2","adjust_creative=SQ3SyM_wbzFDMvSqxv9K6A&hrid=_ztnQ-cZ23vsB4WIsYizaw&utm_campaign=yelp_api_v3&utm_medium=api_v3_business_reviews&utm_source=SQ3SyM_wbzFDMvSqxv9K6A","969-nyc-coffee-jackson-heights-2","9Y2NmfyJpmxBz-IHSkkjIA","cLxp5gIPWIhmvpmdPo7BsA","969 NYC Coffee","$",4.5,281,"Jackson Heights","NY","11372","adjust_creative=SQ3SyM_wbzFDMvSqxv9K6A&utm_campaign=yelp_api_v3&utm_medium=api_v3_business_search&utm_source=SQ3SyM_wbzFDMvSqxv9K6A",40.7478,-73.8855
"Alli K.","Allow me a moment or two to hardcore gush... 

Hiya, Covid-impacted, gluten-free bride here! My large-ish wedding was transformed into a small, backyard...",5,"https://www.yelp.com/biz/by-the-way-bakery-new-york","adjust_creative=SQ3SyM_wbzFDMvSqxv9K6A&hrid=YGFN5iegPDGBXjy3Ghxj0w&utm_campaign=yelp_api_v3&utm_medium=api_v3_business_reviews&utm_source=SQ3SyM_wbzFDMvSqxv9K6A","by-the-way-bakery-new-york","q2yHFOWqQwPtCX5UxOrltg","yaBrQbt7kMrbXAo6qrzpYw","By the Way Bakery","$",4.5,234,"New York","NY","10024","adjust_creative=SQ3SyM_wbzFDMvSqxv9K6A&utm_campaign=yelp_api_v3&utm_medium=api_v3_business_search&utm_source=SQ3SyM_wbzFDMvSqxv9K6A",40.791,-73.9743
"Cristen K.","Truly my favorite shop in the city. I've been buying coffee here for years - even when I moved away to DC for a while and had to have it shipped. The folks...",5,"https://www.yelp.com/biz/mcnultys-tea-and-coffee-co-new-york","adjust_creative=SQ3SyM_wbzFDMvSqxv9K6A&hrid=agb3nJTgdIOBvPLA1K-OBg&utm_campaign=yelp_api_v3&utm_medium=api_v3_business_reviews&utm_source=SQ3SyM_wbzFDMvSqxv9K6A","mcnultys-tea-and-coffee-co-new-york","f_O4TsJC7mUdMsKC0h_1MA","di8nRIJqHeXR3Sf9qdKPQQ","McNulty's Tea & Coffee Co","$$",4.5,241,"New York","NY","10014","adjust_creative=SQ3SyM_wbzFDMvSqxv9K6A&utm_campaign=yelp_api_v3&utm_medium=api_v3_business_search&utm_source=SQ3SyM_wbzFDMvSqxv9K6A",40.7334,-74.005
"Alana T.","Absolutely fantastic spot in the Village run by Sicilian expat Gabriel. This cute little cafe tucked on the corner of Jones and West 4th has only been...",5,"https://www.yelp.com/biz/the-coppola-cafe-new-york","adjust_creative=SQ3SyM_wbzFDMvSqxv9K6A&hrid=dYgnaR1UtHKDYGah7sj1WQ&utm_campaign=yelp_api_v3&utm_medium=api_v3_business_reviews&utm_source=SQ3SyM_wbzFDMvSqxv9K6A","the-coppola-cafe-new-york","oATaHItyxBgD7ncBp9r5rQ","NJay-xUEFsvWzdeohs9EEA","The Coppola Cafe","$",4.5,30,"New York","NY","10014","adjust_creative=SQ3SyM_wbzFDMvSqxv9K6A&utm_campaign=yelp_api_v3&utm_medium=api_v3_business_search&utm_source=SQ3SyM_wbzFDMvSqxv9K6A",40.7322,-74.0016
"Al H.","In the middle of a busy sidewalk market street is this hidden gem of a coffee shop. Although I love coffee, what brought me in was the chicken mushroom...",5,"https://www.yelp.com/biz/haven-cafe-new-york","adjust_creative=SQ3SyM_wbzFDMvSqxv9K6A&hrid=n_Xc9Qap5Fb1eAJsyzfHjA&utm_campaign=yelp_api_v3&utm_medium=api_v3_business_reviews&utm_source=SQ3SyM_wbzFDMvSqxv9K6A","haven-cafe-new-york","0Ilqs2QDFE4PgCidhMch8w","MN17Htz75s1aZvO5nltzPA","Haven Cafe","$",4.5,56,"New York","NY","10013","adjust_creative=SQ3SyM_wbzFDMvSqxv9K6A&utm_campaign=yelp_api_v3&utm_medium=api_v3_business_search&utm_source=SQ3SyM_wbzFDMvSqxv9K6A",40.7189,-73.9967
"Kyle D.","[Delivery review]

The good: These cookies are giant, chunky handfuls of bliss! And when I say handfuls I mean it - they must weigh close to a pound per...",5,"https://www.yelp.com/biz/levain-bakery-new-york","adjust_creative=SQ3SyM_wbzFDMvSqxv9K6A&hrid=WyjISAn21aVZc1sfB1jELw&utm_campaign=yelp_api_v3&utm_medium=api_v3_business_reviews&utm_source=SQ3SyM_wbzFDMvSqxv9K6A","levain-bakery-new-york","O54qpaPFcfpR9rf7f6Ltag","H4jJ7XB3CetIr1pg56CczQ","Levain Bakery","$$",4.5,8303,"New York","NY","10023","adjust_creative=SQ3SyM_wbzFDMvSqxv9K6A&utm_campaign=yelp_api_v3&utm_medium=api_v3_business_search&utm_source=SQ3SyM_wbzFDMvSqxv9K6A",40.78,-73.9803
"Tiffany C.","Divine! 

I love the creme brûlée donut. It was perfect caramelized and good amount of sweet. Just wish it weren't that small so I didn't have to cry a bit...",5,"https://www.yelp.com/biz/doughnut-plant-new-york-6","adjust_creative=SQ3SyM_wbzFDMvSqxv9K6A&hrid=FzkeVIUeZGvmoyw8z9rBsg&utm_campaign=yelp_api_v3&utm_medium=api_v3_business_reviews&utm_source=SQ3SyM_wbzFDMvSqxv9K6A","doughnut-plant-new-york-6","_BF_Kr4ZUlqO_6Tfpf0hTg","lWOkeS-wV4no8qqA9OwwEg","Doughnut Plant","$$",4.5,3233,"New York","NY","10002","adjust_creative=SQ3SyM_wbzFDMvSqxv9K6A&utm_campaign=yelp_api_v3&utm_medium=api_v3_business_search&utm_source=SQ3SyM_wbzFDMvSqxv9K6A",40.7163,-73.9887
"Rosalia X.","One of the best hot chocolate I ever had ! It's so creamy, rich yummy chocolate. It's the prefect drink for a weather like today.",5,"https://www.yelp.com/biz/sant-ambroeus-coffee-bar-at-hanley-new-york-2","adjust_creative=SQ3SyM_wbzFDMvSqxv9K6A&hrid=KpLGmmGT6tLrOWDsOTIOHg&utm_campaign=yelp_api_v3&utm_medium=api_v3_business_reviews&utm_source=SQ3SyM_wbzFDMvSqxv9K6A","sant-ambroeus-coffee-bar-at-hanley-new-york-2","BvRUwN5QUWOdWaYLMEKY2g","cUJQU0enEjgbQjV8CDRfJQ","Sant Ambroeus Coffee Bar at Hanley","$",4.5,26,"New York","NY","10065","adjust_creative=SQ3SyM_wbzFDMvSqxv9K6A&utm_campaign=yelp_api_v3&utm_medium=api_v3_business_search&utm_source=SQ3SyM_wbzFDMvSqxv9K6A",40.7662,-73.9632
"Norma S.","I found Gumption a little by accident, it's in/near Industry City, but I hadn't been on that block in awhile. What a great find! The staff is really...",5,"https://www.yelp.com/biz/gumption-coffee-brooklyn","adjust_creative=SQ3SyM_wbzFDMvSqxv9K6A&hrid=Ak_H-r2nO2fST8pESt38eA&utm_campaign=yelp_api_v3&utm_medium=api_v3_business_reviews&utm_source=SQ3SyM_wbzFDMvSqxv9K6A","gumption-coffee-brooklyn","qcubw8U1jAXM9V9Q4cvJXg","sTXBn90qn-PO2mkdNgzXYw","Gumption Coffee","NULL",4.5,10,"Brooklyn","NY","11232","adjust_creative=SQ3SyM_wbzFDMvSqxv9K6A&utm_campaign=yelp_api_v3&utm_medium=api_v3_business_search&utm_source=SQ3SyM_wbzFDMvSqxv9K6A",40.6554,-74.0109
"Kayo N.","I stumbled upon this cute and teeny little storefront while walking around the neighborhood.  I ordered a coffee and a ham and cheese empanada as a quick...",5,"https://www.yelp.com/biz/fare-and-folk-brooklyn-2","adjust_creative=SQ3SyM_wbzFDMvSqxv9K6A&hrid=yOLOmJ0q5R7fpUNpvdHTBA&utm_campaign=yelp_api_v3&utm_medium=api_v3_business_reviews&utm_source=SQ3SyM_wbzFDMvSqxv9K6A","fare-and-folk-brooklyn-2","upKCYdxGuw2oUtbUQuQRCg","Axg9e5GMO4XUiT8Cop1qFw","Fare and Folk","NULL",4.5,13,"Brooklyn","NY","11201","adjust_creative=SQ3SyM_wbzFDMvSqxv9K6A&utm_campaign=yelp_api_v3&utm_medium=api_v3_business_search&utm_source=SQ3SyM_wbzFDMvSqxv9K6A",40.6875,-73.998
"Randy M.","2020 was terrible year for all of us. A few friends I lovingly called orphans were not traveling home for the holidays due to Covid. I decided to have them...",5,"https://www.yelp.com/biz/breads-bakery-new-york","adjust_creative=SQ3SyM_wbzFDMvSqxv9K6A&hrid=wA0eX7fpYpuNaT672tB8rw&utm_campaign=yelp_api_v3&utm_medium=api_v3_business_reviews&utm_source=SQ3SyM_wbzFDMvSqxv9K6A","breads-bakery-new-york","gDAIvGFe5VbgHSC-KDorZQ","mU23NlQfn1R9OhA6WMe_xg","Breads Bakery","$$",4.5,1044,"New York","NY","10003","adjust_creative=SQ3SyM_wbzFDMvSqxv9K6A&utm_campaign=yelp_api_v3&utm_medium=api_v3_business_search&utm_source=SQ3SyM_wbzFDMvSqxv9K6A",40.7366,-73.9918
"Charisma H.","This is such a wonderful neighborhood coffee shop. We've been going here since we moved to the neighborhood and you really get to see all types here--from...",5,"https://www.yelp.com/biz/frenchy-coffee-new-york","adjust_creative=SQ3SyM_wbzFDMvSqxv9K6A&hrid=uS2yeGDBnsMFM1S7Rmnx5A&utm_campaign=yelp_api_v3&utm_medium=api_v3_business_reviews&utm_source=SQ3SyM_wbzFDMvSqxv9K6A","frenchy-coffee-new-york","Wn2hKKk7aK8xkQ_qq3flvQ","06s4v9tM5JLnsa8UlZFHtQ","Frenchy Coffee","$",4.5,96,"New York","NY","10029","adjust_creative=SQ3SyM_wbzFDMvSqxv9K6A&utm_campaign=yelp_api_v3&utm_medium=api_v3_business_search&utm_source=SQ3SyM_wbzFDMvSqxv9K6A",40.7899,-73.9483
"Kate E.","Great coffee and incredible drink menu with an amazing happy hour (specifically the Prosecco). I was a frequent customer at Five & Dime prior to the...",5,"https://www.yelp.com/biz/five-and-dime-new-york","adjust_creative=SQ3SyM_wbzFDMvSqxv9K6A&hrid=jElkynOnIlklQvxxA7N60w&utm_campaign=yelp_api_v3&utm_medium=api_v3_business_reviews&utm_source=SQ3SyM_wbzFDMvSqxv9K6A","five-and-dime-new-york","Ccva93CziyiDn9qhDnke0w","OQOr0DE1HtSNfxO5_mwfFg","Five & Dime","$$",4.5,87,"New York","NY","10007","adjust_creative=SQ3SyM_wbzFDMvSqxv9K6A&utm_campaign=yelp_api_v3&utm_medium=api_v3_business_search&utm_source=SQ3SyM_wbzFDMvSqxv9K6A",40.7126,-74.008
"Rich B.","Exceptionally tasty bread. 
Exceptionally friendly folks.
We do breakfast here at least once a week. Recommend their massive croissants if you want to get...",5,"https://www.yelp.com/biz/winner-brooklyn","adjust_creative=SQ3SyM_wbzFDMvSqxv9K6A&hrid=7V38a1Kgffk9CHvRgT83Gg&utm_campaign=yelp_api_v3&utm_medium=api_v3_business_reviews&utm_source=SQ3SyM_wbzFDMvSqxv9K6A","winner-brooklyn","Il9EB1SLBALhvp7GOVMokw","xGkjOhRnsIQz_maA6tfhbA","Winner","NULL",4.5,60,"Brooklyn","NY","11215","adjust_creative=SQ3SyM_wbzFDMvSqxv9K6A&utm_campaign=yelp_api_v3&utm_medium=api_v3_business_search&utm_source=SQ3SyM_wbzFDMvSqxv9K6A",40.6657,-73.9824
"Elle G.","Logan and his staff went the extra mile to make sure my coffee got to me. UPS was having some delivery issues and delays (understandable, as there is a lot...",5,"https://www.yelp.com/biz/abbotsford-road-coffee-specialists-brooklyn","adjust_creative=SQ3SyM_wbzFDMvSqxv9K6A&hrid=XB29DZlEuPyKl5aMH-TEiQ&utm_campaign=yelp_api_v3&utm_medium=api_v3_business_reviews&utm_source=SQ3SyM_wbzFDMvSqxv9K6A","abbotsford-road-coffee-specialists-brooklyn","RuX9fhgSxpW0Yw8KW6X3cQ","TQNhPJC5PeUcm901UPd7Sw","Abbotsford Road Coffee Specialists","$$",4.5,35,"Brooklyn","NY","11217","adjust_creative=SQ3SyM_wbzFDMvSqxv9K6A&utm_campaign=yelp_api_v3&utm_medium=api_v3_business_search&utm_source=SQ3SyM_wbzFDMvSqxv9K6A",40.6793,-73.9854
"Sharang T.","I had a large cold brew (no milk no sugar) and (on another yelper's suggestion) the buffalo chicken quesadilla.  The coffee was delicious; it was a warm day...",4,"https://www.yelp.com/biz/kofi-coffee-and-bakery-new-york","adjust_creative=SQ3SyM_wbzFDMvSqxv9K6A&hrid=30T59QvqW5W2r-EPvFbA-w&utm_campaign=yelp_api_v3&utm_medium=api_v3_business_reviews&utm_source=SQ3SyM_wbzFDMvSqxv9K6A","kofi-coffee-and-bakery-new-york","ujcZjGjvI4SFVwU0CFbrng","LVF4FN3E2a384T-piBJlVw","KOFI Coffee & Bakery","NULL",4.5,8,"New York","NY","10065","adjust_creative=SQ3SyM_wbzFDMvSqxv9K6A&utm_campaign=yelp_api_v3&utm_medium=api_v3_business_search&utm_source=SQ3SyM_wbzFDMvSqxv9K6A",40.7616,-73.9631
"Margaret G.","This is a great cafe -- great coffee, great pastries, nice place to hang out Post-COVID. AND you really have to try their take out only, pre order only,...",5,"https://www.yelp.com/biz/buunni-coffee-bronx-2","adjust_creative=SQ3SyM_wbzFDMvSqxv9K6A&hrid=PW2rdUO78u9wTMnANCBvqA&utm_campaign=yelp_api_v3&utm_medium=api_v3_business_reviews&utm_source=SQ3SyM_wbzFDMvSqxv9K6A","buunni-coffee-bronx-2","7SeQuaEAS9261FBbuYFvhw","1QR-AV2_9HB4YnwOLf-sJg","Buunni Coffee","$$",4.5,36,"Bronx","NY","10463","adjust_creative=SQ3SyM_wbzFDMvSqxv9K6A&utm_campaign=yelp_api_v3&utm_medium=api_v3_business_search&utm_source=SQ3SyM_wbzFDMvSqxv9K6A",40.8868,-73.9069
"Christopher T.","Wow, Marine Park Coffee was actually superb. It's amazing and everyone who works here seems like they are really proud of it. Everything we ordered was...",5,"https://www.yelp.com/biz/marine-park-coffee-brooklyn-2","adjust_creative=SQ3SyM_wbzFDMvSqxv9K6A&hrid=F6tNwYG9QmLtPAp50caFZA&utm_campaign=yelp_api_v3&utm_medium=api_v3_business_reviews&utm_source=SQ3SyM_wbzFDMvSqxv9K6A","marine-park-coffee-brooklyn-2","t__8mWsHFgPg5iJ7Y1WQCw","VI7gDy85t9j4jzp7IawaTg","Marine Park Coffee","NULL",4.5,5,"Brooklyn","NY","11234","adjust_creative=SQ3SyM_wbzFDMvSqxv9K6A&utm_campaign=yelp_api_v3&utm_medium=api_v3_business_search&utm_source=SQ3SyM_wbzFDMvSqxv9K6A",40.6091,-73.9326
"Marceau L.","This place is f**king awesome. Imagine an atmosphere like that show Cheers but for gamers, and computer nerds. If starbucks and gamestop had a baby this is...",5,"https://www.yelp.com/biz/waypoint-cafe-new-york","adjust_creative=SQ3SyM_wbzFDMvSqxv9K6A&hrid=IWx3PLrd2M6h_NenC2XOqg&utm_campaign=yelp_api_v3&utm_medium=api_v3_business_reviews&utm_source=SQ3SyM_wbzFDMvSqxv9K6A","waypoint-cafe-new-york","gxnzCMN1fBM2nSirl8tsZQ","IoH3Ge5pRjo4pWRI9T_EIA","Waypoint Cafe","$",4.5,29,"New York","NY","10002","adjust_creative=SQ3SyM_wbzFDMvSqxv9K6A&utm_campaign=yelp_api_v3&utm_medium=api_v3_business_search&utm_source=SQ3SyM_wbzFDMvSqxv9K6A",40.7173,-73.9899
"Angela Z.","Boujie doughnuts, but they're worth the price! Every time I bite into a creation from The Doughnut Project, I am always amazed and proceed to wolf down the...",5,"https://www.yelp.com/biz/the-doughnut-project-new-york","adjust_creative=SQ3SyM_wbzFDMvSqxv9K6A&hrid=0HGRmmGN6YoTV2s-qOWliA&utm_campaign=yelp_api_v3&utm_medium=api_v3_business_reviews&utm_source=SQ3SyM_wbzFDMvSqxv9K6A","the-doughnut-project-new-york","IsKlWwq91Pb2H2i02HLJpg","c6UUcUTbwbk0kOpF6jVOJQ","The Doughnut Project","$",4.5,487,"New York","NY","10014","adjust_creative=SQ3SyM_wbzFDMvSqxv9K6A&utm_campaign=yelp_api_v3&utm_medium=api_v3_business_search&utm_source=SQ3SyM_wbzFDMvSqxv9K6A",40.7312,-74.0035
"Michelle R.","St Kilda is a great spot, but easy to miss because of its rather unfortunate location next to one of the neighborhood's shadier convenience stores.

The...",4,"https://www.yelp.com/biz/st-kilda-coffee-new-york-3","adjust_creative=SQ3SyM_wbzFDMvSqxv9K6A&hrid=uGf03vvrXxTz4J88lAqLMA&utm_campaign=yelp_api_v3&utm_medium=api_v3_business_reviews&utm_source=SQ3SyM_wbzFDMvSqxv9K6A","st-kilda-coffee-new-york-3","T1crBdNwBt2caTkDeh4u2g","eeF68ww4RKu3ymh8W_6Zmw","St Kilda Coffee","NULL",4.5,18,"New York","NY","10011","adjust_creative=SQ3SyM_wbzFDMvSqxv9K6A&utm_campaign=yelp_api_v3&utm_medium=api_v3_business_search&utm_source=SQ3SyM_wbzFDMvSqxv9K6A",40.7439,-73.9997
"Dana M.","I have only ordered delivery from here, but it is super delicious and you can tell that thought is put into the packaging and the creation of the food. 
I...",5,"https://www.yelp.com/biz/dear-mama-new-york-2","adjust_creative=SQ3SyM_wbzFDMvSqxv9K6A&hrid=86TZlHMR-2M0Zk9fd84t_g&utm_campaign=yelp_api_v3&utm_medium=api_v3_business_reviews&utm_source=SQ3SyM_wbzFDMvSqxv9K6A","dear-mama-new-york-2","LjDIqeWnjLR4_Ia9o5MRHg","5o-jorn07AInbmlNlYGC0g","Dear Mama","$",4.5,287,"New York","NY","10029","adjust_creative=SQ3SyM_wbzFDMvSqxv9K6A&utm_campaign=yelp_api_v3&utm_medium=api_v3_business_search&utm_source=SQ3SyM_wbzFDMvSqxv9K6A",40.7923,-73.9406
"Samantha W.","I came with a friend around 11AM on a Friday and we opted to sit inside since it was a bit chilly out. Before we sat down, we had our temperatures taken and...",5,"https://www.yelp.com/biz/good-thanks-cafe-new-york","adjust_creative=SQ3SyM_wbzFDMvSqxv9K6A&hrid=otlf5TUGHzEeFARHmGgfBw&utm_campaign=yelp_api_v3&utm_medium=api_v3_business_reviews&utm_source=SQ3SyM_wbzFDMvSqxv9K6A","good-thanks-cafe-new-york","iR_Ndioz2bL-PVB8BQd5uw","vZevXSC1w27dEvXc2EHCEg","Good Thanks Cafe","$$",4.5,207,"New York","NY","10002","adjust_creative=SQ3SyM_wbzFDMvSqxv9K6A&utm_campaign=yelp_api_v3&utm_medium=api_v3_business_search&utm_source=SQ3SyM_wbzFDMvSqxv9K6A",40.7197,-73.9895
"Craig Z.","Note to the barista that made/served my drink: if you don't know what coffee you are serving (i.e. which blend/single origin, roast, etc.) you shouldn't be...",3,"https://www.yelp.com/biz/eleva-coffee-brooklyn-2","adjust_creative=SQ3SyM_wbzFDMvSqxv9K6A&hrid=pTFlNectOUaMwlht-ithcA&utm_campaign=yelp_api_v3&utm_medium=api_v3_business_reviews&utm_source=SQ3SyM_wbzFDMvSqxv9K6A","eleva-coffee-brooklyn-2","Fbio_hP3XGglNvg2fIQzwg","mdm-Ov-6q-dmra0qPPuXTg","Eleva Coffee","NULL",4.5,14,"Brooklyn","NY","11211","adjust_creative=SQ3SyM_wbzFDMvSqxv9K6A&utm_campaign=yelp_api_v3&utm_medium=api_v3_business_search&utm_source=SQ3SyM_wbzFDMvSqxv9K6A",40.7115,-73.9463
"Mae R.","I love Daytime and am so excited that they've been able to persevere through the pandemic. I'm a Barista and one of my favorite things to do when I'm off...",5,"https://www.yelp.com/biz/daytime-brooklyn-2","adjust_creative=SQ3SyM_wbzFDMvSqxv9K6A&hrid=gV7vN5F2-dJEZIFz77cH2g&utm_campaign=yelp_api_v3&utm_medium=api_v3_business_reviews&utm_source=SQ3SyM_wbzFDMvSqxv9K6A","daytime-brooklyn-2","IX483s7ediqcRgkHY-W65g","aCeHq1ZWKCI_wux0vOW1nA","Daytime","NULL",4.5,50,"Brooklyn","NY","11215","adjust_creative=SQ3SyM_wbzFDMvSqxv9K6A&utm_campaign=yelp_api_v3&utm_medium=api_v3_business_search&utm_source=SQ3SyM_wbzFDMvSqxv9K6A",40.6586,-73.9781
"Sam C.","This place transports you right back to Italy! If you are depressed about being cooped up in covid times go here for the perfect pick me up! So delicious,...",5,"https://www.yelp.com/biz/lella-alimentari-brooklyn","adjust_creative=SQ3SyM_wbzFDMvSqxv9K6A&hrid=2o7pxu1MBFC7V54S7l5u4g&utm_campaign=yelp_api_v3&utm_medium=api_v3_business_reviews&utm_source=SQ3SyM_wbzFDMvSqxv9K6A","lella-alimentari-brooklyn","BM4SAUZNYj7bfBsNaGjpBw","UpPXAjKc-CyuCg72chwd3A","Lella Alimentari","$$",4.5,211,"Brooklyn","NY","11211","adjust_creative=SQ3SyM_wbzFDMvSqxv9K6A&utm_campaign=yelp_api_v3&utm_medium=api_v3_business_search&utm_source=SQ3SyM_wbzFDMvSqxv9K6A",40.7152,-73.9465
"Gina A.","I adore this place. Their interesting drink combinations (especially seasonal specialties), food and pastries are all incredible. Their hojicha maple pie,...",5,"https://www.yelp.com/biz/bird-and-branch-new-york","adjust_creative=SQ3SyM_wbzFDMvSqxv9K6A&hrid=j0LLRtG7Obqk0GpLO8Xxng&utm_campaign=yelp_api_v3&utm_medium=api_v3_business_reviews&utm_source=SQ3SyM_wbzFDMvSqxv9K6A","bird-and-branch-new-york","zbaY8nqiXFoAqqXjYSQjbQ","IkyRp47Jpbk_AQ35qlr-eg","Bird & Branch","$$",4.5,273,"New York","NY","10036","adjust_creative=SQ3SyM_wbzFDMvSqxv9K6A&utm_campaign=yelp_api_v3&utm_medium=api_v3_business_search&utm_source=SQ3SyM_wbzFDMvSqxv9K6A",40.7603,-73.9909
"Annie C.","Such a cute little cafe in a small park where you can grab you quick morning coffee! 

It's small but the workers are super super friendly and caring. This...",5,"https://www.yelp.com/biz/mudpark-new-york","adjust_creative=SQ3SyM_wbzFDMvSqxv9K6A&hrid=sCPvO0WiG2UAWXaFecbzcg&utm_campaign=yelp_api_v3&utm_medium=api_v3_business_reviews&utm_source=SQ3SyM_wbzFDMvSqxv9K6A","mudpark-new-york","hMywMs5H1sNa9aIoyE-6RQ","rF7YK9EubHQ74FwXYmg-eA","Mudpark","$",4.5,35,"New York","NY","10003","adjust_creative=SQ3SyM_wbzFDMvSqxv9K6A&utm_campaign=yelp_api_v3&utm_medium=api_v3_business_search&utm_source=SQ3SyM_wbzFDMvSqxv9K6A",40.7232,-73.9887
"Laura C.","Delicious, fresh and easy food with healthy/local/vegan options. The staff is super nice and their outdoor area is very pleasant for a street-side dining...",5,"https://www.yelp.com/biz/roots-cafe-brooklyn-3","adjust_creative=SQ3SyM_wbzFDMvSqxv9K6A&hrid=jhEB0EZI4GonFGdKZXMQ7g&utm_campaign=yelp_api_v3&utm_medium=api_v3_business_reviews&utm_source=SQ3SyM_wbzFDMvSqxv9K6A","roots-cafe-brooklyn-3","KsqPvIDFepv57PP6tV5tdA","nqXvLzqzQQTJ2eMPkAcojw","Roots Cafe","$$",4.5,321,"Brooklyn","NY","11215","adjust_creative=SQ3SyM_wbzFDMvSqxv9K6A&utm_campaign=yelp_api_v3&utm_medium=api_v3_business_search&utm_source=SQ3SyM_wbzFDMvSqxv9K6A",40.6628,-73.9917
"Leroy C.","My time at robin was relaxed. The Staff knowledge of juices put me at ease. My Fav Drink is ABC ( apple, beets, and carrots). 
For an aging fella like...",4,"https://www.yelp.com/biz/robin-cafe-brooklyn-2","adjust_creative=SQ3SyM_wbzFDMvSqxv9K6A&hrid=IEYb3nDjcNLBSPKQEMKbSA&utm_campaign=yelp_api_v3&utm_medium=api_v3_business_reviews&utm_source=SQ3SyM_wbzFDMvSqxv9K6A","robin-cafe-brooklyn-2","RWE5o1lUCrk0wDLiiEgLpA","vADnOTNjEi93Xv5NPY10dQ","ROBIN CAFE","NULL",4.5,2,"Brooklyn","NY","11226","adjust_creative=SQ3SyM_wbzFDMvSqxv9K6A&utm_campaign=yelp_api_v3&utm_medium=api_v3_business_search&utm_source=SQ3SyM_wbzFDMvSqxv9K6A",40.6558,-73.9533
"Anlan T.","Came back, space is upgraded with a backyard patio. Got a artichoke grilled cheese; it was really goood! Great experience, will definitely come back .

P.S....",5,"https://www.yelp.com/biz/flor-de-azalea-cafe-astoria","adjust_creative=SQ3SyM_wbzFDMvSqxv9K6A&hrid=Kg8B6Hhni0BJcr7YQ1Am1w&utm_campaign=yelp_api_v3&utm_medium=api_v3_business_reviews&utm_source=SQ3SyM_wbzFDMvSqxv9K6A","flor-de-azalea-cafe-astoria","NPycBV7_acjK1RxWpvIDQg","QjMeljDv9TH5BWzsDfwLVw","Flor de Azalea Cafe","NULL",4.5,48,"Astoria","NY","11106","adjust_creative=SQ3SyM_wbzFDMvSqxv9K6A&utm_campaign=yelp_api_v3&utm_medium=api_v3_business_search&utm_source=SQ3SyM_wbzFDMvSqxv9K6A",40.7651,-73.9394
"Donovan H.","Worth a try if you're local or make a trip.

It's my local spot!

Safety: All precautions are taken and there is no indoor space for customers at all during...",5,"https://www.yelp.com/biz/super-nice-coffee-and-bakery-new-york-3","adjust_creative=SQ3SyM_wbzFDMvSqxv9K6A&hrid=P06oFok2nitZEEM0448qUg&utm_campaign=yelp_api_v3&utm_medium=api_v3_business_reviews&utm_source=SQ3SyM_wbzFDMvSqxv9K6A","super-nice-coffee-and-bakery-new-york-3","a05OZh3gS-sl-T9b7BWEtA","T5kcIHgs0fBq0GfKjGPG0g","Super Nice Coffee and Bakery","NULL",4.5,75,"New York","NY","10035","adjust_creative=SQ3SyM_wbzFDMvSqxv9K6A&utm_campaign=yelp_api_v3&utm_medium=api_v3_business_search&utm_source=SQ3SyM_wbzFDMvSqxv9K6A",40.7991,-73.941
"Christy S.","What a cute and ambiance place to go to have a really great cup of real coffee. It is super comfortable and cozy. It is a great place to do some work, talk...",5,"https://www.yelp.com/biz/main-street-coffee-staten-island-2","adjust_creative=SQ3SyM_wbzFDMvSqxv9K6A&hrid=xPqYN1p7bGJzHTr-TyMetg&utm_campaign=yelp_api_v3&utm_medium=api_v3_business_reviews&utm_source=SQ3SyM_wbzFDMvSqxv9K6A","main-street-coffee-staten-island-2","qTiyqgNP04IQhToDW-FVyA","lWxBB2GMjBGLK2DFi-G50Q","Main Street Coffee","NULL",4.5,10,"Staten Island","NY","10307","adjust_creative=SQ3SyM_wbzFDMvSqxv9K6A&utm_campaign=yelp_api_v3&utm_medium=api_v3_business_search&utm_source=SQ3SyM_wbzFDMvSqxv9K6A",40.5108,-74.2484
"A.K. L.","I've been going to Astoria Coffee before and after the lockdowns and I'll continue to come here even if I move away from the area. Perfect coffee and great...",5,"https://www.yelp.com/biz/astoria-coffee-astoria","adjust_creative=SQ3SyM_wbzFDMvSqxv9K6A&hrid=NIAYZhioettYB76cV7g_PQ&utm_campaign=yelp_api_v3&utm_medium=api_v3_business_reviews&utm_source=SQ3SyM_wbzFDMvSqxv9K6A","astoria-coffee-astoria","G2_4EKdV6YQDMs0cXFM9XQ","V0lISq2CcalvgAxAHMLwgA","Astoria Coffee","$",4.5,300,"Astoria","NY","11102","adjust_creative=SQ3SyM_wbzFDMvSqxv9K6A&utm_campaign=yelp_api_v3&utm_medium=api_v3_business_search&utm_source=SQ3SyM_wbzFDMvSqxv9K6A",40.7671,-73.9225
"Cuiyu W.","the almond croissant was heavenly. flakey and buttery like a croissant should be and the almond filling was perfectly proportioned and delicious. favorite...",5,"https://www.yelp.com/biz/caf%C3%A9-beit-brooklyn-3","adjust_creative=SQ3SyM_wbzFDMvSqxv9K6A&hrid=PpN6sG0C6JGOLCaqbyMrDg&utm_campaign=yelp_api_v3&utm_medium=api_v3_business_reviews&utm_source=SQ3SyM_wbzFDMvSqxv9K6A","caf%C3%A9-beit-brooklyn-3","AeuV_vq3OvxhFqypiKzl-w","RvRvU-xl5PYFrZ0KSU6CUQ","Café Beit","$",4.5,93,"Brooklyn","NY","11249","adjust_creative=SQ3SyM_wbzFDMvSqxv9K6A&utm_campaign=yelp_api_v3&utm_medium=api_v3_business_search&utm_source=SQ3SyM_wbzFDMvSqxv9K6A",40.7187,-73.9571
"Heather H.","Love the Victorian decor inside. Only been her for breakfast takeout during COVID, but the veggie burrito is fantastic, make sure to get the hot sauce!...",5,"https://www.yelp.com/biz/fiction-brooklyn","adjust_creative=SQ3SyM_wbzFDMvSqxv9K6A&hrid=iopW_yhGwG0Yia-HElW3Iw&utm_campaign=yelp_api_v3&utm_medium=api_v3_business_reviews&utm_source=SQ3SyM_wbzFDMvSqxv9K6A","fiction-brooklyn","tV38XCIUtywW2ZGCFgJFsQ","A8jRnZGiMJiMpfHt8qKV3w","Fiction","$",4.5,89,"Brooklyn","NY","11211","adjust_creative=SQ3SyM_wbzFDMvSqxv9K6A&utm_campaign=yelp_api_v3&utm_medium=api_v3_business_search&utm_source=SQ3SyM_wbzFDMvSqxv9K6A",40.7072,-73.9537
"Rance Z.","So I think I had walked by here a few times and, being in a rush, didn't have it click that it was not part of the neighboring restaurant- how embarrassing...",5,"https://www.yelp.com/biz/ix-restaurant-brooklyn-3","adjust_creative=SQ3SyM_wbzFDMvSqxv9K6A&hrid=2yFPlpn2JyZkbzElq2RFrw&utm_campaign=yelp_api_v3&utm_medium=api_v3_business_reviews&utm_source=SQ3SyM_wbzFDMvSqxv9K6A","ix-restaurant-brooklyn-3","FmV8rduy7MFsXm0xjZsweA","mv4A3Yl90ZLONO03ksqRrg","Ix Restaurant","$$",4.5,149,"Brooklyn","NY","11225","adjust_creative=SQ3SyM_wbzFDMvSqxv9K6A&utm_campaign=yelp_api_v3&utm_medium=api_v3_business_search&utm_source=SQ3SyM_wbzFDMvSqxv9K6A",40.6609,-73.9614
